<?xml version="1.0" encoding="UTF-8"?>
<!--  WITSML v1.2 versus v1.3. -->
<schemaDiff 
	xmlns="http://www.posc.org/schemas/schemaDiff" 
	xmlns:xsi="http://www.w3.org/2001/XMLSchema-instance" 
	xsi:schemaLocation="http://www.posc.org/schemas/schemaDiff 
			   ./schemaDiff.xsd">
	<fileset>
		<fileold>
			<name>attgrp_uid.xsd</name>
			<newFileName>attgrp_uid.xsd</newFileName>
		</fileold>
		<fileold>
			<name>cs_activity.xsd</name>
			<newFileName>cs_activity.xsd</newFileName>
		</fileold>
		<fileold>
			<name>cs_axisDefinition.xsd</name>
			<newFileName>cs_axisDefinition.xsd</newFileName>
		</fileold>
		<fileold>
			<name>cs_bend.xsd</name>
			<newFileName>cs_bend.xsd</newFileName>
		</fileold>
		<fileold>
			<name>cs_bitRecord.xsd</name>
			<newFileName>cs_bitRecord.xsd</newFileName>
		</fileold>
		<fileold>
			<name>cs_blockCurveInfo.xsd</name>
			<newFileName>cs_blockCurveInfo.xsd</newFileName>
		</fileold>
		<fileold>
			<name>cs_blockInfo.xsd</name>
			<newFileName>cs_blockInfo.xsd</newFileName>
		</fileold>
		<fileold>
			<name>cs_bop.xsd</name>
			<newFileName>cs_bop.xsd</newFileName>
		</fileold>
		<fileold>
			<name>cs_bopComponent.xsd</name>
			<newFileName>cs_bopComponent.xsd</newFileName>
		</fileold>
		<fileold>
			<name>cs_boxInformation.xsd</name>
			<status>DELETE</status>
		</fileold>
		<fileold>
			<name>cs_calibration.xsd</name>
			<status>DELETE</status>
		</fileold>
		<fileold>
			<name>cs_calibrationParameter.xsd</name>
			<status>DELETE</status>
		</fileold>
		<fileold>
			<name>cs_cementAdditive.xsd</name>
			<newFileName>cs_cementAdditive.xsd</newFileName>
		</fileold>
		<fileold>
			<name>cs_cementingFluid.xsd</name>
			<newFileName>cs_cementingFluid.xsd</newFileName>
		</fileold>
		<fileold>
			<name>cs_cementPumpSchedule.xsd</name>
			<newFileName>cs_cementPumpSchedule.xsd</newFileName>
		</fileold>
		<fileold>
			<name>cs_cementStage.xsd</name>
			<newFileName>cs_cementStage.xsd</newFileName>
		</fileold>
		<fileold>
			<name>cs_cementTest.xsd</name>
			<newFileName>cs_cementTest.xsd</newFileName>
		</fileold>
		<fileold>
			<name>cs_centrifuge.xsd</name>
			<newFileName>cs_centrifuge.xsd</newFileName>
		</fileold>
		<fileold>
			<name>cs_channel.xsd</name>
			<newFileName>cs_channel.xsd</newFileName>
		</fileold>
		<fileold>
			<name>cs_channelDefinition.xsd</name>
			<newFileName>cs_channelDefinition.xsd</newFileName>
		</fileold>
		<fileold>
			<name>cs_chromatograph.xsd</name>
			<newFileName>cs_chromatograph.xsd</newFileName>
		</fileold>
		<fileold>
			<name>cs_commonData.xsd</name>
			<newFileName>cs_commonData.xsd</newFileName>
		</fileold>
		<fileold>
			<name>cs_connection.xsd</name>
			<newFileName>cs_connection.xsd</newFileName>
		</fileold>
		<fileold>
			<name>cs_customData.xsd</name>
			<newFileName>cs_customData.xsd</newFileName>
		</fileold>
		<fileold>
			<name>cs_dayCost.xsd</name>
			<newFileName>cs_dayCost.xsd</newFileName>
		</fileold>
		<fileold>
			<name>cs_degasser.xsd</name>
			<newFileName>cs_degasser.xsd</newFileName>
		</fileold>
		<fileold>
			<name>cs_documentInfo.xsd</name>
			<typeold>
				<name>cs_documentInfo</name>
				<typenew>
					<file>cs_documentInfo.xsd</file>
					<type>cs_documentInfo</type>
					<elementmap>
						<oldname>DocumentName</oldname>
						<newname>documentName</newname>
						<status>RENAME</status>
					</elementmap>
					<elementmap>
						<oldname>DocumentAlias</oldname>
						<newname>documentAlias</newname>
						<status>RENAME</status>
					</elementmap>
					<elementmap>
						<oldname>DocumentDate</oldname>
						<newname>documentDate</newname>
						<status>RENAME</status>
					</elementmap>
					<elementmap>
						<oldname>FileCreationInformation</oldname>
						<newname>fileCreationInformation</newname>
						<status>RENAME</status>
					</elementmap>
					<elementmap>
						<oldname>SecurityInformation</oldname>
						<newname>securityInformation</newname>
						<status>RENAME</status>
					</elementmap>
					<elementmap>
						<oldname>Disclaimer</oldname>
						<newname>disclaimer</newname>
						<status>RENAME</status>
					</elementmap>
					<elementmap>
						<oldname>AuditTrail</oldname>
						<newname>auditTrail</newname>
						<status>RENAME</status>
					</elementmap>
					<elementmap>
						<oldname>Owner</oldname>
						<newname>owner</newname>
						<status>RENAME</status>
					</elementmap>
					<elementmap>
						<oldname>Comment</oldname>
						<newname>comment</newname>
						<status>RENAME</status>
					</elementmap>
				</typenew>
			</typeold>
			<typeold>
				<name>fileCreationType</name>
				<typenew>
					<file>cs_documentFileCreation.xsd</file>
					<type>cs_documentFileCreation</type>
					<elementmap>
						<oldname>FileCreationDate</oldname>
						<newname>fileCreationDate</newname>
						<status>RENAME</status>
					</elementmap>
					<elementmap>
						<oldname>SoftwareName</oldname>
						<newname>softwareName</newname>
						<status>RENAME</status>
					</elementmap>
					<elementmap>
						<oldname>FileCreator</oldname>
						<newname>fileCreator</newname>
						<status>RENAME</status>
					</elementmap>
					<elementmap>
						<oldname>Comment</oldname>
						<newname>comment</newname>
						<status>RENAME</status>
					</elementmap>
				</typenew>
			</typeold>
			<typeold>
				<name>securityInfoType</name>
				<typenew>
					<file>cs_documentSecurityInfo.xsd</file>
					<type>cs_documentSecurityInfo</type>
					<elementmap>
						<oldname>Class</oldname>
						<newname>class</newname>
						<status>RENAME</status>
					</elementmap>
					<elementmap>
						<oldname>System</oldname>
						<newname>securitySystem</newname>
						<status>RENAME</status>
					</elementmap>
					<elementmap>
						<oldname>EndDate</oldname>
						<newname>endDate</newname>
						<status>RENAME</status>
					</elementmap>
					<elementmap>
						<oldname>Comment</oldname>
						<newname>comment</newname>
						<status>RENAME</status>
					</elementmap>
				</typenew>
			</typeold>
			<typeold>
				<name>auditType</name>
				<typenew>
					<file>cs_documentAudit.xsd</file>
					<type>cs_documentAudit</type>
					<elementmap>
						<oldname>Event</oldname>
						<newname>event</newname>
						<status>RENAME</status>
					</elementmap>
				</typenew>
			</typeold>
			<typeold>
				<name>eventType</name>
				<typenew>
					<file>cs_documentEvent.xsd</file>
					<type>cs_documentEvent</type>
					<elementmap>
						<oldname>EventDate</oldname>
						<newname>eventDate</newname>
						<status>RENAME</status>
					</elementmap>
					<elementmap>
						<oldname>ResponsibleParty</oldname>
						<newname>responsibleParty</newname>
						<status>RENAME</status>
					</elementmap>
					<elementmap>
						<oldname>Comment</oldname>
						<newname>comment</newname>
						<status>RENAME</status>
					</elementmap>
				</typenew>
			</typeold>
		</fileold>
		<fileold>
			<name>cs_drillingParams.xsd</name>
			<newFileName>cs_drillingParams.xsd</newFileName>
		</fileold>
		<fileold>
			<name>cs_enumValues.xsd</name>
			<newFileName>ancillary/cs_enumValues.xsd</newFileName>
		</fileold>
		<fileold>
			<name>cs_errorReport.xsd</name>
			<status>DELETE</status>
		</fileold>
		<fileold>
			<name>cs_fiber.xsd</name>
			<status>DELETE</status>
		</fileold>
		<fileold>
			<name>cs_fiberEndPoint.xsd</name>
			<status>DELETE</status>
		</fileold>
		<fileold>
			<name>cs_fiberInformation.xsd</name>
			<status>DELETE</status>
		</fileold>
		<fileold>
			<name>cs_fiberInstalledPoints.xsd</name>
			<status>DELETE</status>
		</fileold>
		<fileold>
			<name>cs_fluid.xsd</name>
			<newFileName>cs_fluid.xsd</newFileName>
		</fileold>
		<fileold>
			<name>cs_geodeticModel.xsd</name>
			<newFileName>cs_geodeticModel.xsd</newFileName>
		</fileold>
		<fileold>
			<name>cs_geologyInterval.xsd</name>
			<newFileName>cs_geologyInterval.xsd</newFileName>
		</fileold>
		<fileold>
			<name>cs_groupDefinition.xsd</name>
			<newFileName>cs_groupDefinition.xsd</newFileName>
		</fileold>
		<fileold>
			<name>cs_holeOpener.xsd</name>
			<newFileName>cs_holeOpener.xsd</newFileName>
		</fileold>
		<fileold>
			<name>cs_hse.xsd</name>
			<newFileName>cs_hse.xsd</newFileName>
		</fileold>
		<fileold>
			<name>cs_hydrocyclone.xsd</name>
			<newFileName>cs_hydrocyclone.xsd</newFileName>
		</fileold>
		<fileold>
			<name>cs_incident.xsd</name>
			<newFileName>cs_incident.xsd</newFileName>
		</fileold>
		<fileold>
			<name>cs_instrumentBox.xsd</name>
			<status>DELETE</status>
		</fileold>
		<fileold>
			<name>cs_instrumentBoxCalibration.xsd</name>
			<status>DELETE</status>
		</fileold>
		<fileold>
			<name>cs_interval.xsd</name>
			<newFileName>cs_interval.xsd</newFileName>
		</fileold>
		<fileold>
			<name>cs_inventory.xsd</name>
			<newFileName>cs_inventory.xsd</newFileName>
		</fileold>
		<fileold>
			<name>cs_jar.xsd</name>
			<newFileName>cs_jar.xsd</newFileName>
		</fileold>
		<fileold>
			<name>cs_lithology.xsd</name>
			<newFileName>cs_lithology.xsd</newFileName>
		</fileold>
		<fileold>
			<name>cs_localCRS.xsd</name>
			<newFileName>cs_localCRS.xsd</newFileName>
		</fileold>
		<fileold>
			<name>cs_location.xsd</name>
			<newFileName>cs_location.xsd</newFileName>
		</fileold>
		<fileold>
			<name>cs_logCurveInfo.xsd</name>
			<newFileName>cs_logCurveInfo.xsd</newFileName>
		</fileold>
		<fileold>
			<name>cs_logData.xsd</name>
			<newFileName>cs_logData.xsd</newFileName>
		</fileold>
		<fileold>
			<name>cs_motor.xsd</name>
			<newFileName>cs_motor.xsd</newFileName>
		</fileold>
		<fileold>
			<name>cs_mudGas.xsd</name>
			<newFileName>cs_mudGas.xsd</newFileName>
		</fileold>
		<fileold>
			<name>cs_mudLogParameter.xsd</name>
			<newFileName>cs_mudLogParameter.xsd</newFileName>
		</fileold>
		<fileold>
			<name>cs_mudLosses.xsd</name>
			<newFileName>cs_mudLosses.xsd</newFileName>
		</fileold>
		<fileold>
			<name>cs_mudVolume.xsd</name>
			<newFileName>cs_mudVolume.xsd</newFileName>
		</fileold>
		<fileold>
			<name>cs_mwdTool.xsd</name>